{
  "schemaVersion": "v6",
  "subject": {
    "digest": {
      "sha1": "f5c7bbd01096c0a66c1ca84b7cf96b79a8e8762e"
    }
  },
  "transcriptLeaves": [
    {
      "leafIndex": 0,
      "reviewerName": "code-reviewer",
      "transcriptHash": "f2ee111bff8970676f29ae54b6af5042571be124d73a50d5cd087c10d23aa425",
      "verdictClass": "self-authored",
      "harnessTranscriptHash": null
    },
    {
      "leafIndex": 1,
      "reviewerName": "test-reviewer",
      "transcriptHash": "5efb6847073ebaff1007a0f262ffe8d4db14c009f84a39ee81095acba47faa2a",
      "verdictClass": "self-authored",
      "harnessTranscriptHash": null
    },
    {
      "leafIndex": 2,
      "reviewerName": "security-reviewer",
      "transcriptHash": "0ba41a0fbf7c36c1b6e318c2cd7fb7121aa5af9cca322bfc67cdfcc2e882fd1c",
      "verdictClass": "self-authored",
      "harnessTranscriptHash": null
    }
  ],
  "merkleProofs": [
    {
      "leafIndex": 0,
      "proof": [
        "366a40dd8dd5cd2ee9ef65d65440fd7be8c0c6a24ffbcc6fb243f58377315bda",
        "69c3d8dbf791c29fc7b332d138b55035b7c74f8137b09db6bea6bb9cdef69b87"
      ]
    },
    {
      "leafIndex": 1,
      "proof": [
        "9ba61d3559aa8ffed32daff25c793877b12eb536bc563340b93215231257df9d",
        "69c3d8dbf791c29fc7b332d138b55035b7c74f8137b09db6bea6bb9cdef69b87"
      ]
    },
    {
      "leafIndex": 2,
      "proof": [
        "52aed4593ca2a55b10ec80f05d4b79a001f1d6887078840cb42c0d766541ba3d",
        "cd54e27febd440b42d11564c941723f39897370941a504da68cb854df06fd8fa"
      ]
    }
  ],
  "rootHash": "93fb746b58b60fe96f28ce2b375e95b0ae26bf65a92e7203856474b0bfae519b",
  "rootSignature": "zOTWEwg4uxlvsR/93Qk9fn0zucv+dGm2IPf4ngiQh/ZJj2BdVz4L3aApGH6iPSTXSRJXgF1wJcTMGnL1GjOPAw==",
  "nonce": "c2d69775915e8f4925e2356984a6ca395c2357a78306f818010c39b49349452d",
  "leafCount": 3,
  "signedAt": "2026-10-02T16:46:23.902Z",
  "signerIdentity": "dominique@local:doms-macbook"
}
