{
  "schemaVersion": "v6",
  "subject": {
    "digest": {
      "sha1": "958a3347f88aa204031c1e98a1294366ba0a64f7"
    }
  },
  "transcriptLeaves": [
    {
      "leafIndex": 59,
      "reviewerName": "code-reviewer",
      "transcriptHash": "246e123d886465a0200234f13cb30ea3456a1bc71d014285b4f4e7432744d43c"
    },
    {
      "leafIndex": 60,
      "reviewerName": "test-reviewer",
      "transcriptHash": "67f8decf08a49228aacbd950b63a764122533273b896ccbd0eb01dc790add7c9"
    },
    {
      "leafIndex": 61,
      "reviewerName": "security-reviewer",
      "transcriptHash": "ced2dacda4be81b750005e909dd890211dfbbadd53ff1082fcb9bdadaec7fc81"
    }
  ],
  "merkleProofs": [
    {
      "leafIndex": 59,
      "proof": [
        "5211b47d66507813901d3470d2668287c46b21d1b0e4ebc0f9c4d4e0439509d7",
        "7e0a9db5a98e306e47110038c6c9de611f72ee1001a01fd4e3f3ff4e7d0a878e"
      ]
    },
    {
      "leafIndex": 60,
      "proof": [
        "ae1dc0195aad95bf0f61852c640b53837ea1dfb440621ae172ed814dad9f2ee5",
        "7e0a9db5a98e306e47110038c6c9de611f72ee1001a01fd4e3f3ff4e7d0a878e"
      ]
    },
    {
      "leafIndex": 61,
      "proof": [
        "e5913bb46d7c4f76e3324267ba657ef05a53d18b2dc7caf2b914d62140f8cac5",
        "86048ca44e3b47f3681db71dab8d16370138b3ecf6a959c06f3fce084ecfb7d4"
      ]
    }
  ],
  "rootHash": "76b3cffc60e86ceef7af9e4ea46f558ddc7a3b33a619155ff198956ca3d24749",
  "rootSignature": "2PHCeGLmtk23hiAou9/W0DhbDsH/biHyDgO+i/jkomVjF2DUvWQMUwQRnV/8Wi1BOCINx4lNmmHdqdzt2raVAg==",
  "nonce": "e332801f71898ed840d09ade7e80c996ecb2f7d7be8c5247f58830aee8d74daa",
  "leafCount": 3,
  "signedAt": "2026-05-25T09:02:42.744Z",
  "signerIdentity": "dominique@local:doms-macbook"
}
