{
  "schemaVersion": "v6",
  "subject": {
    "digest": {
      "sha1": "c360e563c52ba656c548429bda4e71a7bfefad77"
    }
  },
  "transcriptLeaves": [
    {
      "leafIndex": 20,
      "reviewerName": "code-reviewer",
      "transcriptHash": "01073fff0d9ef013a948631025b57aaec851dc7cbf4705d7518e029de9eb5da5"
    },
    {
      "leafIndex": 21,
      "reviewerName": "test-reviewer",
      "transcriptHash": "ea1c8a07199b8059716f809faad478015f96eb5a087eb82dc4262e009b54e37e"
    },
    {
      "leafIndex": 22,
      "reviewerName": "security-reviewer",
      "transcriptHash": "5260ac5e4e3fb42d1fa545c550b9f64b563c6689047099ce5b63185e2d3621ad"
    }
  ],
  "merkleProofs": [
    {
      "leafIndex": 20,
      "proof": [
        "ec3f670589f281cde220a69cc801e93acab464175bab7cbc00a91e1776702ef2",
        "73b364b2ed7f13e66dd8f99a14bb704c4bc3ae6c096e4df21a8910442924a02d",
        "59fdbb70381b5dea9784cc000094616af8603d3c2d46a2c58737b8cf8c6ce996",
        "c2ed212645764c462d83357044d3dcb1ae20ebe7e72bfa6ae0606cfa4ecb2691",
        "0d2e8feb1708a911d7fd446ac0c7ea8d3414b8a16ea5d42c6628e9fb71757eae"
      ]
    },
    {
      "leafIndex": 21,
      "proof": [
        "81243a62d709346099ff5459e8b47990fedc71465b5658ca6f7387a5769e4fa6",
        "73b364b2ed7f13e66dd8f99a14bb704c4bc3ae6c096e4df21a8910442924a02d",
        "59fdbb70381b5dea9784cc000094616af8603d3c2d46a2c58737b8cf8c6ce996",
        "c2ed212645764c462d83357044d3dcb1ae20ebe7e72bfa6ae0606cfa4ecb2691",
        "0d2e8feb1708a911d7fd446ac0c7ea8d3414b8a16ea5d42c6628e9fb71757eae"
      ]
    },
    {
      "leafIndex": 22,
      "proof": [
        "0b1e6a5edf5e8ba42613f01c82f0df764c320eff460507c7478d55327743250c",
        "428590a562db848cb368bbbc5fd429f5aed4f1958531c9f9140578141360bdb8",
        "59fdbb70381b5dea9784cc000094616af8603d3c2d46a2c58737b8cf8c6ce996",
        "c2ed212645764c462d83357044d3dcb1ae20ebe7e72bfa6ae0606cfa4ecb2691",
        "0d2e8feb1708a911d7fd446ac0c7ea8d3414b8a16ea5d42c6628e9fb71757eae"
      ]
    }
  ],
  "rootHash": "f5b5074f2e593fef69d9988de59100163a9bb48cd7d6a46ee6e1b488d82ec863",
  "rootSignature": "7kuFQPVXYCYjKfUqPHZE1tTExAuD0NryEU7e70nEOWcj2aN3uwMYYSlTd0lnhLWUFFV533Nd6bY2OShGW7PbCA==",
  "nonce": "e22ceb0635b342975dcfa8f0d6c8a9d515bc4e32bf334f9c77b20fad0631d823",
  "leafCount": 23,
  "signedAt": "2026-05-24T22:24:25.443Z",
  "signerIdentity": "dominique@local:doms-macbook"
}
