{
  "schemaVersion": "v6",
  "subject": {
    "digest": {
      "sha1": "96b08794efa451ddee74db20e3326ac81cc5dae6"
    }
  },
  "transcriptLeaves": [
    {
      "leafIndex": 0,
      "reviewerName": "code-reviewer",
      "transcriptHash": "87bde26adffe0bab21a2de3e72033691c5314d0b6c1c2563541f5b6320fd8de2"
    },
    {
      "leafIndex": 1,
      "reviewerName": "test-reviewer",
      "transcriptHash": "f741aeb861f87b2f64ca545b6699f4eb5eae747a3763d30d1e116d8913dc47c6"
    },
    {
      "leafIndex": 2,
      "reviewerName": "security-reviewer",
      "transcriptHash": "367b05d8490001f1903a199214a2c51496ec86ca7e59074e13e0ea6ee7627e5d"
    }
  ],
  "merkleProofs": [
    {
      "leafIndex": 0,
      "proof": [
        "2dc539e7fba2f75f305e87eb21da0397f4c5947e4a1c12245dc67b6d2ad2cbae",
        "c39a360d672c35d015206267ea700b1bb3f0ba0a49ffaf84cca40d3366399b0c"
      ]
    },
    {
      "leafIndex": 1,
      "proof": [
        "3faed050967d55826eba1a0436617b95aef1d051a367d936eaee2fd5928baeb1",
        "c39a360d672c35d015206267ea700b1bb3f0ba0a49ffaf84cca40d3366399b0c"
      ]
    },
    {
      "leafIndex": 2,
      "proof": [
        "f3cea8f986a6f9e2b26c61f50da245709acda8f1bbe586664af1687c603b1a03",
        "991c34a4a8a2b97cc7066671bbc0d20fd6d64a5535d473189f4a7e03aa120f7f"
      ]
    }
  ],
  "rootHash": "fe8e56d7a6a389bd8a1785bed7d6d3d3072fdd4527e0fe0fe17c64151bdabeea",
  "rootSignature": "qYm7eEQtQt1b4izeIMjQPqZgZ2Kgte8h3HiecmLN7DZWfj+JPOBiEG+lSsCH8KT6jFr48EMTB0QWLIrKu5axCg==",
  "nonce": "116fc0f22a2ac0d042c650c618e757f330ad1b8d1ee63896bad604b8b2678166",
  "leafCount": 3,
  "signedAt": "2026-05-27T03:23:50.558Z",
  "signerIdentity": "dominique@local:doms-macbook"
}
