{
  "schemaVersion": "v6",
  "subject": {
    "digest": {
      "sha1": "c045186a5e342130cfc48ce2535f56d2ad94a1c7"
    }
  },
  "transcriptLeaves": [
    {
      "leafIndex": 0,
      "reviewerName": "code-reviewer",
      "transcriptHash": "93915e129bb02d75b4cc8a13ddd49814e4e976b97f1d6917d166f683b293d351",
      "verdictClass": "self-authored",
      "harnessTranscriptHash": null
    },
    {
      "leafIndex": 1,
      "reviewerName": "test-reviewer",
      "transcriptHash": "20c3d6076a61676e1c67987078e96c28f46a1d29256e7f64675d201448f182be",
      "verdictClass": "self-authored",
      "harnessTranscriptHash": null
    },
    {
      "leafIndex": 2,
      "reviewerName": "security-reviewer",
      "transcriptHash": "457913bd1af9872ff3fcff762c478743cd4e265a5fe2e928c3b2a83b9d24bd69",
      "verdictClass": "self-authored",
      "harnessTranscriptHash": null
    }
  ],
  "merkleProofs": [
    {
      "leafIndex": 0,
      "proof": [
        "64b69d100832a123f54663bb582f498449fdaf84855e2ce400fa61d56d855b63",
        "78ded01ca39693fa36f834b967fc6c1cc9840422f41fea405a59aec811b4ce2e"
      ]
    },
    {
      "leafIndex": 1,
      "proof": [
        "e8b361fdda2b6d0f045fbaf2e016f28e4e5ccba779cabc537406b4f531f5a527",
        "78ded01ca39693fa36f834b967fc6c1cc9840422f41fea405a59aec811b4ce2e"
      ]
    },
    {
      "leafIndex": 2,
      "proof": [
        "08e37c05a584353f0af14360002967798ff08f4a34e9681695ff8d20c2463043",
        "b01de42bc8ce614754f2ce74a0c0643de3883f5d1139c6a8dfde02da39240e68"
      ]
    }
  ],
  "rootHash": "453ff3d14a774e568d77bbfb89986a425bf2cafa435048e1aa71eb9509b468e7",
  "rootSignature": "1pWz0EWexBtgTnPnh3zZ49W40B7NIYCTJKNOQeE94cMDD2Ulj1BoVhp4f3sguvxPb94G1v7UzNyIFU9FMgJ7Bg==",
  "nonce": "068866c4c4cb5ade7cceb7e337d1e980f7e4befafbd5f53937d2390de053e371",
  "leafCount": 3,
  "signedAt": "2026-09-06T23:38:00.715Z",
  "signerIdentity": "dominique@local:doms-macbook"
}
